{
  "registry_id": "asiep-v0.1-external-source-registry",
  "registry_version": "0.1.0",
  "created_at": "2026-05-05T00:00:00Z",
  "verification_mode": "web-primary-source-check-with-local-caveats",
  "sources": [
    {
      "source_id": "self_refine_2023",
      "citation_key": "self_refine_2023",
      "title": "Self-Refine: Iterative Refinement with Self-Feedback",
      "source_type": "preprint",
      "authority_level": "primary",
      "url": "https://arxiv.org/abs/2303.17651",
      "archived_url": "",
      "authors": ["Aman Madaan", "et al."],
      "organization": "arXiv",
      "publication_date": "2023",
      "version": "arXiv:2303.17651",
      "accessed_at": "2026-05-05",
      "verification_status": "verified",
      "supports_claim_ids": ["C1", "C13"],
      "supported_statements": [
        "Self-Refine is an agent or LLM self-improvement method focused on iterative refinement through self-feedback.",
        "ASIEP should be positioned as an evidence layer beside self-improvement algorithms, not as a replacement algorithm."
      ],
      "caveats": ["Preprint or paper page status should be rechecked before submission."],
      "replacement_or_preferred_source": "",
      "notes": "Used for related-work positioning of self-improvement methods."
    },
    {
      "source_id": "reflexion_2023",
      "citation_key": "reflexion_2023",
      "title": "Reflexion: Language Agents with Verbal Reinforcement Learning",
      "source_type": "preprint",
      "authority_level": "primary",
      "url": "https://arxiv.org/abs/2303.11366",
      "archived_url": "",
      "authors": ["Noah Shinn", "Federico Cassano", "Ashwin Gopinath", "Karthik Narasimhan", "Shunyu Yao"],
      "organization": "arXiv",
      "publication_date": "2023",
      "version": "arXiv:2303.11366",
      "accessed_at": "2026-05-05",
      "verification_status": "verified",
      "supports_claim_ids": ["C1", "C13"],
      "supported_statements": [
        "Reflexion is a self-reflection and feedback-based agent method.",
        "ASIEP does not claim to replace behavioral improvement methods."
      ],
      "caveats": ["Publication and peer-review status should be checked before a camera-ready paper."],
      "replacement_or_preferred_source": "",
      "notes": "Used for self-improvement related work."
    },
    {
      "source_id": "voyager_2023",
      "citation_key": "voyager_2023",
      "title": "Voyager: An Open-Ended Embodied Agent with Large Language Models",
      "source_type": "preprint",
      "authority_level": "primary",
      "url": "https://arxiv.org/abs/2305.16291",
      "archived_url": "",
      "authors": ["Guanzhi Wang", "Yuqi Xie", "Yunfan Jiang", "Ajay Mandlekar", "Chaowei Xiao", "Yuke Zhu", "Linjie Fan", "Anima Anandkumar"],
      "organization": "arXiv",
      "publication_date": "2023",
      "version": "arXiv:2305.16291",
      "accessed_at": "2026-05-05",
      "verification_status": "verified",
      "supports_claim_ids": ["C1", "C13"],
      "supported_statements": [
        "Voyager is an open-ended embodied agent work involving iterative skill acquisition.",
        "ASIEP is narrower: it records accountability evidence for self-improvement events."
      ],
      "caveats": ["Use as background for agent self-improvement rather than direct standards evidence."],
      "replacement_or_preferred_source": "",
      "notes": "Used for related-work contrast with agent behavior improvement."
    },
    {
      "source_id": "agentdevel_2026",
      "citation_key": "agentdevel_2026",
      "title": "AgentDevel: Reframing Self-Evolving LLM Agents as Release Engineering",
      "source_type": "preprint",
      "authority_level": "primary",
      "url": "https://arxiv.org/abs/2601.04620",
      "archived_url": "",
      "authors": ["Cunxiang Wang", "et al."],
      "organization": "arXiv",
      "publication_date": "2026",
      "version": "arXiv:2601.04620",
      "accessed_at": "2026-05-05",
      "verification_status": "verified",
      "supports_claim_ids": ["C1", "C13"],
      "supported_statements": [
        "AgentDevel is a directly related self-evolving agent and release-engineering reference point.",
        "ASIEP should be framed as complementary evidence accountability, not as a replacement for AgentDevel."
      ],
      "caveats": ["Preprint status and final publication venue should be rechecked before submission."],
      "replacement_or_preferred_source": "",
      "notes": "Most direct related work for positioning."
    },
    {
      "source_id": "otel_genai_semconv",
      "citation_key": "otel_genai_semconv",
      "title": "Semantic conventions for generative AI systems",
      "source_type": "official_documentation",
      "authority_level": "canonical",
      "url": "https://opentelemetry.io/docs/specs/semconv/gen-ai/",
      "archived_url": "",
      "authors": [],
      "organization": "OpenTelemetry",
      "publication_date": "",
      "version": "Development status page accessed 2026-05-05",
      "accessed_at": "2026-05-05",
      "verification_status": "verified",
      "supports_claim_ids": ["C8", "C9"],
      "supported_statements": [
        "OpenTelemetry GenAI semantic conventions are documented by OpenTelemetry.",
        "The GenAI semantic conventions page was marked Development at access time."
      ],
      "caveats": ["Specification status can change; recheck close to submission."],
      "replacement_or_preferred_source": "",
      "notes": "Used for trace-source and standard-status claims."
    },
    {
      "source_id": "otel_genai_agent_spans",
      "citation_key": "otel_genai_agent_spans",
      "title": "Semantic Conventions for GenAI agent and framework spans",
      "source_type": "official_documentation",
      "authority_level": "canonical",
      "url": "https://opentelemetry.io/docs/specs/semconv/gen-ai/gen-ai-agent-spans/",
      "archived_url": "",
      "authors": [],
      "organization": "OpenTelemetry",
      "publication_date": "",
      "version": "Development status page accessed 2026-05-05",
      "accessed_at": "2026-05-05",
      "verification_status": "verified",
      "supports_claim_ids": ["C8", "C9"],
      "supported_statements": [
        "OpenTelemetry lists GenAI operation names such as create_agent, invoke_agent, and execute_tool in agent span conventions.",
        "The relevant operation values are marked Development at access time."
      ],
      "caveats": ["Development status means ASIEP should not claim stable OTel conformance."],
      "replacement_or_preferred_source": "",
      "notes": "Used to justify OTel-like fixture mapping without claiming collector integration."
    },
    {
      "source_id": "langsmith_observability_concepts",
      "citation_key": "langsmith_observability_concepts",
      "title": "LangSmith Observability concepts",
      "source_type": "product_documentation",
      "authority_level": "canonical",
      "url": "https://docs.langchain.com/langsmith/observability-concepts",
      "archived_url": "",
      "authors": [],
      "organization": "LangChain",
      "publication_date": "",
      "version": "Documentation accessed 2026-05-05",
      "accessed_at": "2026-05-05",
      "verification_status": "verified",
      "supports_claim_ids": ["C9"],
      "supported_statements": [
        "LangSmith documents trace and run concepts for observability.",
        "LangSmith is product documentation, not an open standard."
      ],
      "caveats": ["Product documentation can change without stable standards versioning."],
      "replacement_or_preferred_source": "",
      "notes": "Used for LangSmith-like trace fixture positioning."
    },
    {
      "source_id": "langsmith_feedback_docs",
      "citation_key": "langsmith_feedback_docs",
      "title": "Log user feedback using the SDK",
      "source_type": "product_documentation",
      "authority_level": "canonical",
      "url": "https://docs.langchain.com/langsmith/attach-user-feedback",
      "archived_url": "",
      "authors": [],
      "organization": "LangChain",
      "publication_date": "",
      "version": "Documentation accessed 2026-05-05",
      "accessed_at": "2026-05-05",
      "verification_status": "verified",
      "supports_claim_ids": ["C9"],
      "supported_statements": [
        "LangSmith documents feedback attached to traces or runs.",
        "ASIEP's LangSmith-like fixture is a local abstraction over documented trace and feedback concepts."
      ],
      "caveats": ["ASIEP does not call the LangSmith API in M8."],
      "replacement_or_preferred_source": "",
      "notes": "Used for feedback mapping in related work."
    },
    {
      "source_id": "w3c_prov_dm",
      "citation_key": "w3c_prov_dm",
      "title": "PROV-DM: The PROV Data Model",
      "source_type": "official_standard",
      "authority_level": "canonical",
      "url": "https://www.w3.org/TR/prov-dm/",
      "archived_url": "",
      "authors": ["Luc Moreau", "Paolo Missier"],
      "organization": "W3C",
      "publication_date": "2013-04-30",
      "version": "W3C Recommendation",
      "accessed_at": "2026-05-05",
      "verification_status": "verified",
      "supports_claim_ids": ["C8", "C9"],
      "supported_statements": [
        "PROV-DM is a W3C Recommendation and a domain-agnostic provenance data model.",
        "PROV-DM core concepts include entities, activities, and agents."
      ],
      "caveats": ["PROV provides provenance structure but not ASIEP-specific gate, repair, or bundle policies."],
      "replacement_or_preferred_source": "",
      "notes": "Primary provenance mapping source."
    },
    {
      "source_id": "w3c_prov_o",
      "citation_key": "w3c_prov_o",
      "title": "PROV-O: The PROV Ontology",
      "source_type": "official_standard",
      "authority_level": "canonical",
      "url": "https://www.w3.org/TR/prov-o/",
      "archived_url": "",
      "authors": ["Timothy Lebo", "Satya Sahoo", "Deborah McGuinness"],